<?xml version="1.0" encoding="UTF-8"?>
<obstacles xmlns="http://www.github.com/bryanvullo/RunwayRedeclaration"
           xmlns:xsi="http://www.w3.org/2001/XMLSchema-instance"
           xsi:schemaLocation="http://www.github.com/bryanvullo/RunwayRedeclaration obstacleSchema.xsd"
>
    <obstacle>
        <obstacleName>Test Obstacle 1</obstacleName>
        <obstacleHeight>5.0</obstacleHeight>
        <obstacleWidth>5.0</obstacleWidth>
        <obstacleLength>15.0</obstacleLength>
        <obstacleLeftThresholdDistance>1.0</obstacleLeftThresholdDistance>
        <obstacleRightThresholdDistance>1.0</obstacleRightThresholdDistance>
        <obstacleDistanceFromCentre>1.0</obstacleDistanceFromCentre>
    </obstacle>
</obstacles>
